Чем заканчиваются день и ночь?,Не знаю,Просто проходят,Мягким знаком,3
Принадлежит это вам - но другие люди используют это гораздо чаще чем вы сами?,Моя зубная щетка,Украденный аккаунт из PS Store,Имя,3
Какое колесо не будет вращаться при повороте направо?,Моя таблетка от укачиванияв месте со мной,Запасное,Никакое - мои колеса на штраф-площадке :(,2
Что никогда не влезет в самую большую кастрюлю?,У меня все время каша уплывает - значит каша,Ее крышка,Всегда найдется кострюля по крупнее,2
Какой узел не сможет развязать ни один человек?,Узел на мокрых шнурках когда высохнут,Железнодорожный,Можно и ножницами любой узел  разрезать - не вижу разницы,2
Кто носит самую большую в мире шляпу?,Тот кто купил самую дорогую и пафосную одежду у кутюрье средней руки,Тот - у кого совершенно нет вкуса,Тот - у кого самая большая в мире голова,3